Keyword,Frequency
is hpv an std,6600
is hpv a std,2400
hpv std,1300
std hpv,1300
hpv is a std,880
can you get pregnant with hpv,590
pregnant with hpv,590
hpv while pregnant,480
is hpv std,390
can hpv cause miscarriage,320
pregnant hpv,260
testing positive for hpv while pregnant,260
can i get pregnant with hpv,210
does hpv show up on std test,210
hpv a std,210
hpv crabs std,210
hpv molluscum contagiosum std,210
hpv pregnant,210
hpv when pregnant,210
is hpv a std or sti,210
is hpv an std or sti,210
is hpv an sti,210
is hpv an sti or std,210
is hpv std or sti,210
can you get pregnant if you have hpv,140
hpv std test,140
hpv vaccine for pregnant,140
hpv vaccine pregnant,140
hpv vaccine when pregnant,140
do std tests check for hpv,110
hpv a sti,110
hpv non std bumps,110
is hpv a sti,110
is hpv considered an std,110
