Keyword,Frequency
birth chart,301000
birth chart calculator,60500
cafe astrology birth chart,33100
free birth chart,33100
birth chart free,27100
birth flower chart,22200
birth chart astrology,18100
birth chart compatibility,18100
astrology birth chart,14800
natal birth chart,14800
birth chart generator,9900
birth chart reading,9900
chinese birth chart,9900
my birth chart,9900
zodiac birth chart,9900
astro seek birth chart,8100
astrological birth chart,5400
vedic birth chart,5400
astro cafe birth chart,4400
birth charts,4400
astrology cafe birth chart,3600
birth chart ],3600
birth chart zodiac,3600
birth natal chart,3600
birth stone chart,3600
costar birth chart,3600
free birth chart analysis,3600
vedic astrology birth chart,3600
best astrology birth chart,2900
chinese birth chart 2022,2900
what is my birth chart,2900
astro birth chart,2400
beyonce birth chart,2400
birth chart cafe astrology,2400
full birth chart,2400
amber heard birth chart,2400
birth chart analysis,1900
birth chart houses,1900
birth month flowers chart,1900
cafe astology birth chart,1900
cafeastrology birth chart,1900
calculate birth chart,1900
free astrology birth chart,1900
horoscope birth chart,1900
how to read a birth chart,1900
johnny depp birth chart,1900
kanye west birth chart,1900
kim kardashian birth chart,1900
sidereal birth chart,1900
taylor swift birth chart,1900
what's my birth chart,1900
astro.com birth chart,1600
astrolabe birth chart,1600
birth chart compatibility calculator,1600
birth sign chart,1600
elon musk birth chart,1600
free natal birth chart,1600
harry styles birth chart,1600
jeffrey dahmer birth chart,1600
selena gomez birth chart,1600
sza birth chart,1600
ariana grande birth chart,1300
astro com birth chart,1300
astrocafe birth chart,1300
astrotheme birth chart,1300
birth chart astro seek,1300
chani nicholas birth chart,1300
compatibility birth chart,1300
drake birth chart,1300
free birth chart calculator,1300
free birth chart reading,1300
how to read birth chart,1300
miley cyrus birth chart,1300
what is a birth chart,1300
astrodienst birth chart,1300
birth chart calc,1000
birth chart meaning,1000
birth chart synastry,1000
birth flowers chart,1000
co star birth chart,1000
free birth chart astrology,1000
free birth charts,1000
how to read your birth chart,1000
jenna ortega birth chart,1000
kourtney kardashian birth chart,1000
kylie jenner birth chart,1000
lana del rey birth chart,1000
megan fox birth chart,1000
nicki minaj birth chart,1000
princess diana birth chart,1000
whats my birth chart,1000
zendaya birth chart,1000
angelina jolie birth chart,1000
astrology birth chart compatibility,1000
astroseek birth chart,1000
bad bunny birth chart,880
best free birth chart,880
billie eilish birth chart,880
birth chart horoscope,880
birth chart reading free,880
cardi b birth chart,880
chrisean rock birth chart,880
find my birth chart,880
free birth chart compatibility,880
full astrology birth chart,880
jack harlow birth chart,880
justin bieber birth chart,880
khloe kardashian birth chart,880
lady gaga birth chart,880
megan thee stallion birth chart,880
meghan markle birth chart,880
michael jackson birth chart,880
timothee chalamet birth chart,880
will smith birth chart,880
astro charts birth chart,880
astrology free birth chart,880
birth chart astro,720
birth chart love compatibility,720
birth chart maker,720
birth chart reader,720
birth chart vedic,720
birth chart.,720
birth month flower chart,720
birth star chart,720
britney spears birth chart,720
chinese birth chart 2023,720
elvis presley birth chart,720
jay z birth chart,720
kehlani birth chart,720
kendall jenner birth chart,720
kurt cobain birth chart,720
pamela anderson birth chart,720
pedro pascal birth chart,720
prince harry birth chart,720
prokerala birth chart,720
reading a birth chart,720
robert pattinson birth chart,720
stephen boss birth chart,720
the weeknd birth chart,720
travis barker birth chart,720
tyler the creator birth chart,720
vedic birth chart calculator,720
zodiac sign birth chart,720
alabe birth chart,720
alexa demie birth chart,720
andrew tate birth chart,720
asap rocky birth chart,720
astrology birth charts,720
astrology compatibility birth chart,720
astro-seek birth chart,720
aubrey plaza birth chart,720
birth chart astrology free,590
birth chart astro-seek,590
birth chart calculator free,590
birth chart calculator sun moon rising,590
birth chart interpretation,590
birth chart transits,590
birth chart wheel,590
birth charts free,590
blueface birth chart,590
cafe astrology free birth chart,590
celebrity birth charts,590
compare birth charts,590
draconic birth chart,590
eminem birth chart,590
free astrological birth chart,590
free vedic birth chart with interpretation,590
hailey bieber birth chart,590
indigo child birth chart,590
jhene aiko birth chart,590
joseph quinn birth chart,590
kendrick lamar birth chart,590
kris jenner birth chart,590
month zodiac birth chart,590
my astrology birth chart,590
olivia rodrigo birth chart,590
queen elizabeth birth chart,590
aaliyah birth chart,590
alix earle birth chart,590
amy winehouse birth chart,590
astro-chart birth chart,590
astrology birth chart free,590
astrosofa birth chart,590
austin butler birth chart,590
birth astrology chart,480
birth ball positions chart,480
birth chart calculatir,480
birth chart compatability,480
birth chart explained,480
birth chart rising sign,480
birth chart with houses,480
birth time chart,480
blake lively birth chart,480
blue face birth chart,480
brad pitt birth chart,480
drew barrymore birth chart,480
emma chamberlain birth chart,480
free birth chart compatibility report,480
free vedic birth chart,480
full birth chart astrology,480
future birth chart,480
ice spice birth chart,480
jennifer lopez birth chart,480
keke palmer birth chart,480
leonardo dicaprio birth chart,480
leslie jordan birth chart,480
lil wayne birth chart,480
lizzo birth chart,480
lori harvey birth chart,480
madonna birth chart,480
mariah carey birth chart,480
millie bobby brown birth chart,480
my birth chart free,480
numerology birth chart,480
prince birth chart,480
progressed birth chart,480
ryan reynolds birth chart,480
shakira birth chart,480
ted bundy birth chart,480
tom holland birth chart,480
whitney houston birth chart,480
adele birth chart,480
amelia dimoldenberg birth chart,480
andrew garfield birth chart,480
astrolabe free birth chart,480
astrology birth chart calculator,480
ben affleck birth chart,390
birth chart app,390
birth chart astro cafe,390
birth chart book,390
birth chart cafe,390
birth chart houses calculator,390
birth chart online,390
birth chart planet meanings,390
birth chart report,390
birth compatibility chart free,390
birth signs chart,390
birth stone charts,390
brent faiyaz birth chart,390
cafe astro birth chart,390
cafe astrology birth chart calculator,390
cafe astrology birth chart compatibility,390
create birth chart,390
dua lipa birth chart,390
elvis birth chart,390
frank ocean birth chart,390
free astrology birth charts,390
free birth charts astrology,390
free online birth chart,390
gordon ramsay birth chart,390
hitler birth chart,390
hitlers birth chart,390
houses in birth chart,390
how to find my birth chart,390
how to find your birth chart,390
jada pinkett smith birth chart,390
julia fox birth chart,390
jungkook birth chart,390
kali uchis birth chart,390
kanye birth chart,390
katy perry birth chart,390
kevin gates birth chart,390
method man birth chart,390
mila kunis birth chart,390
paris hilton birth chart,390
sidereal astrology birth chart,390
sidereal birth chart calculator,390
sydney sweeney birth chart,390
tom cruise birth chart,390
tommy lee birth chart,390
tupac birth chart,390
twin flame birth chart calculator,390
whole sign birth chart,390
winona ryder birth chart,390
xxxtentacion birth chart,390
zoe kravitz birth chart,390
50 cent birth chart,390
800 horoscope birth chart,390
adam levine birth chart,390
anne hathaway birth chart,390
best birth chart analysis,320
birth card chart,320
birth chart analysis free,320
birth chart circle,320
birth chart compatablity,320
birth chart compatibility free,320
birth chart compatibility percentage,320
birth chart creator,320
birth chart lookup,320
birth chart meaning of planets,320
birth chart natal,320
birth chart readings,320
birth chart symbols,320
birth chart without time,320
birth charts astrology,320
birth color chart,320
birth flower chart tattoo,320
birth order characteristics chart,320
birth stones chart,320
calculate my birth chart,320
chani birth chart,320
cher birth chart,320
chloe bailey birth chart,320
compatible birth charts,320
demi lovato birth chart,320
dolly parton birth chart,320
erykah badu birth chart,320
find birth chart,320
finn wolfhard birth chart,320
florence pugh birth chart,320
gemini birth chart,320
gigi hadid birth chart,320
grimes birth chart,320
halle bailey birth chart,320
halsey birth chart,320
horoscope chart birth,320
how do i find my birth chart,320
how to read my birth chart,320
jeff bezos birth chart,320
jennette mccurdy birth chart,320
jennifer aniston birth chart,320
jennifer lawrence birth chart,320
jim carrey birth chart,320
joe biden birth chart,320
kobe bryant birth chart,320
margot robbie birth chart,320
mike tyson birth chart,320
my birth chart astrology,320
natal birth chart free,320
natal birth chart reading,320
north west birth chart,320
olivia wilde birth chart,320
pauly d birth chart,320
phoebe bridgers birth chart,320
post malone birth chart,320
professional birth chart reading,320
putin birth chart,320
robin williams birth chart,320
scott disick birth chart,320
shemhamphorash birth chart,320
star birth chart,320
stevie nicks birth chart,320
summer walker birth chart,320
tom brady birth chart,320
tristan thompson birth chart,320
yung miami birth chart,320
21 savage birth chart,320
aquarius birth chart,320
aries birth chart,320
ashton kutcher birth chart,320
astro seek birth chart calculator,320
astrology birth chart reading,320
audrey hepburn birth chart,320
best astrology birth chart free,260
best birth chart analysis free,260
big sean birth chart,260
birth chart astrotheme,260
birth chart calculator costar,260
birth chart comparison,260
birth chart finder,260
birth chart personality analysis,260
birth chart placements,260
birth chart sun moon rising,260
birth charts compatibility,260
birth moon chart,260
birth natal chart free,260
birth zodiac chart,260
bts birth charts,260
capricorn birth chart,260
cara delevingne birth chart,260
chinese zodiac birth chart,260
chiron birth chart,260
chiron in birth chart,260
chris rock birth chart,260
cillian murphy birth chart,260
circle birth chart,260
circular birth chart,260
dakota johnson birth chart,260
david bowie birth chart,260
elizabeth holmes birth chart,260
find your birth chart,260
fiona apple birth chart,260
fka twigs birth chart,260
free birth chart readings,260
free starseed birth chart calculator,260
hayley williams birth chart,260
henry cavill birth chart,260
horoscopes birth chart,260
houses birth chart,260
j cole birth chart,260
jacob elordi birth chart,260
jamie campbell bower birth chart,260
janet jackson birth chart,260
javon walton birth chart,260
jlo birth chart,260
joe keery birth chart,260
john wayne gacy birth chart,260
king charles birth chart,260
kristen stewart birth chart,260
lauren london birth chart,260
lebron james birth chart,260
leo birth chart,260
libra birth chart,260
lil baby birth chart,260
lily rose depp birth chart,260
lindsay lohan birth chart,260
love compatibility birth chart,260
machine gun kelly birth chart,260
matty healy birth chart,260
melanie martinez birth chart,260
mia goth birth chart,260
mitski birth chart,260
nba youngboy birth chart,260
nick cannon birth chart,260
penn badgley birth chart,260
pisces birth chart,260
prince william birth chart,260
professional birth chart reading free,260
read my birth chart,260
rosalia birth chart,260
ryan gosling birth chart,260
saweetie birth chart,260
scorpio birth chart,260
selena quintanilla birth chart,260
shawn mendes birth chart,260
snooki birth chart,260
star chart birth,260
takeoff birth chart,260
travis scott birth chart,260
trisha paytas birth chart,260
vanessa hudgens birth chart,260
vedic birth chart free,260
virgo birth chart,260
what does my birth chart mean,260
zodiac signs birth chart,260
accurate birth chart,260
adam sandler birth chart,260
alicia keys birth chart,260
ana de armas birth chart,260
anthony bourdain birth chart,260
anya taylor-joy birth chart,260
asteroids in birth chart,260
asteroids in the birth chart,260
astro theme birth chart,260
astrolada birth chart,260
astrological birth chart free,260
astrology.com birth chart,260
best birth chart,210
bill gates birth chart,210
birth chart aspects,210
birth chart astro chart,210
birth chart astro com,210
birth chart calcula,210
birth chart calculato,210
birth chart calculator compatibility,210
birth chart compatibility for marriage,210
birth chart for free,210
birth chart free online,210
birth chart houses meaning,210
birth chart reading near me,210
birth chart sidereal,210
birth chart signs,210
birth chart tattoo,210
birth day chart,210
birth dilation chart,210
birth flower chart by month,210
birth horoscope chart,210
birth rate chart,210
birth tree chart,210
bjork birth chart,210
brittany murphy birth chart,210
bruno mars birth chart,210
bts birth chart,210
cafe astrology natal birth chart,210
camila cabello birth chart,210
cancer birth chart,210
celebrity birth chart,210
charles manson birth chart,210
chinese astrology birth chart,210
chris brown birth chart,210
christian bale birth chart,210
ciara birth chart,210
co-star birth chart,210
courtney love birth chart,210
cristiano ronaldo birth chart,210
dove cameron birth chart,210
dylan o brien birth chart,210
emma roberts birth chart,210
emma watson birth chart,210
ezra miller birth chart,210
freddie mercury birth chart,210
free birth chart interpretation,210
free birth chart report,210
free full birth chart,210
free vedic birth chart interpretation,210
gisele bündchen birth chart,210
gwen stefani birth chart,210
heath ledger birth chart,210
hilary duff birth chart,210
horoscope based on birth chart,210
how to find birth chart,210
hozier birth chart,210
jaden smith birth chart,210
jared leto birth chart,210
jason momoa birth chart,210
jennifer coolidge birth chart,210
jesus birth chart,210
joe rogan birth chart,210
john lennon birth chart,210
john mayer birth chart,210
juice wrld birth chart,210
julia roberts birth chart,210
justin timberlake birth chart,210
jwoww birth chart,210
kate middleton birth chart,210
kevin hart birth chart,210
kim k birth chart,210
liam hemsworth birth chart,210
lil durk birth chart,210
lilith in birth chart,210
look up birth chart,210
lorde birth chart,210
madison beer birth chart,210
mariah the scientist birth chart,210
maya hawke birth chart,210
mgk birth chart,210
michael b jordan birth chart,210
michael jordan birth chart,210
my astrological birth chart,210
naomi campbell birth chart,210
natal birth chart calculator,210
natal birth chart compatibility,210
natal chart birth,210
natalie portman birth chart,210
nipsey hussle birth chart,210
noah schnapp birth chart,210
offset birth chart,210
online birth chart,210
oscar isaac birth chart,210
phoenix marie birth chart,210
prince charles birth chart,210
priscilla presley birth chart,210
r kelly birth chart,210
retro saturn in birth chart,210
sabrina carpenter birth chart,210
sadie sink birth chart,210
sagittarius birth chart,210
sandra bullock birth chart,210
saturn retrograde in birth chart,210
scarlett johansson birth chart,210
shia labeouf birth chart,210
shinzo abe birth chart,210
sign birth chart,210
soulmate birth chart calculator,210
taurus birth chart,210
teal swan birth chart,210
tory lanez birth chart,210
tyler henry birth chart,210
us birth rate chart,210
vinnie hacker birth chart,210
wendy williams birth chart,210
what's a birth chart,210
willow smith birth chart,210
young thug birth chart,210
zac efron birth chart,210
zayn malik birth chart,210
zodiac birth chart calculator,210
zodiac birth chart dates,210
aaron carter birth chart,210
abby lee miller birth chart,210
adam driver birth chart,210
addison rae birth chart,210
albert einstein birth chart,210
alex murdaugh birth chart,210
alex turner birth chart,210
anna delvey birth chart,210
asteroids birth chart,210
astology birth chart,210
astro chart birth chart,210
astro com free birth chart,210
astrosage birth chart,210
astroseek com birth chart,210
avril lavigne birth chart,210
azealia banks birth chart,210
barack obama birth chart,210
best birth chart compatibility,210
best vedic birth chart calculator,210
birth chart astrolabe,210
birth chart explanation,210
birth chart generate,210
birth chart numerology,210
birth chart sign,210
birth chart with degrees,210
birth flowers by month chart,210
birth natal chart cafe astrology,210
birth weight chart,210
cafe astrology compatibility birth chart,170
cafe.astrology birth chart,170
casey anthony birth chart,170
channing tatum birth chart,170
charli d'amelio birth chart,170
charli xcx birth chart,170
charlie puth birth chart,170
chinese birth chart calculator,170
christina aguilera birth chart,170
coi leray birth chart,170
conan gray birth chart,170
conceive birth chart,170
conception birth chart,170
dacre montgomery birth chart,170
diddy birth chart,170
donald trump birth chart,170
elizabeth taylor birth chart,170
emily ratajkowski birth chart,170
emma stone birth chart,170
florence welch birth chart,170
free birth chart cafe astrology,170
free birth natal chart,170
george clooney birth chart,170
gerard way birth chart,170
get birth chart,170
get my birth chart,170
how to figure out your birth chart,170
jake gyllenhaal birth chart,170
jeffree star birth chart,170
jim morrison birth chart,170
jimin birth chart,170
joe alwyn birth chart,170
joe burrow birth chart,170
joji birth chart,170
jojo siwa birth chart,170
jt birth chart,170
juno birth chart,170
kate bush birth chart,170
kate moss birth chart,170
kelis birth chart,170
kyrie irving birth chart,170
lauryn hill birth chart,170
lil nas x birth chart,170
lil peep birth chart,170
lil uzi vert birth chart,170
lilith birth chart,170
maddie ziegler birth chart,170
matt smith birth chart,170
matthew mcconaughey birth chart,170
mayan astrology birth chart,170
monthly birth flower chart,170
nancy pelosi birth chart,170
natalia dyer birth chart,170
neonatal birth chart,170
nick jonas birth chart,170
nicole kidman birth chart,170
nle choppa birth chart,170
oprah birth chart,170
pam anderson birth chart,170
playboi carti birth chart,170
quavo birth chart,170
rachel mcadams birth chart,170
ray j birth chart,170
reading birth chart,170
richard ramirez birth chart,170
rico nasty birth chart,170
risk of birth defects with age chart,170
rob kardashian birth chart,170
ross lynch birth chart,170
sade birth chart,170
sarah jessica parker birth chart,170
sebastian stan birth chart,170
serena williams birth chart,170
taehyung birth chart,170
tana mongeau birth chart,170
tarot birth chart,170
tattoo birth flower chart,170
tropical birth chart,170
trumps birth chart,170
twin flame birth chart calculator free,170
tyra banks birth chart,170
understanding birth chart,170
usher birth chart,170
violet myers birth chart,170
what is a birth chart in astrology,170
whats a birth chart,170
adriana lima birth chart,170
aidan gallagher birth chart,170
amanda seyfried birth chart,170
andy warhol birth chart,170
anna nicole smith birth chart,170
anna wintour birth chart,170
arcturian starseed birth chart,170
ari fletcher birth chart,170
asteroid birth chart,170
astro com birth chart calculator,170
astro free birth chart,170
astro seek com birth chart,170
astrolabe birth chart free,170
astrologi birth chart,170
astrology com birth chart,170
astroseek free birth chart,170
astrotheme birth chart calculator,170
august alsina birth chart,170
beyoncé birth chart,170
big 3 birth chart,170
birth chart breakdown,170
birth chart calculation,170
birth chart calculator astrology,170
birth chart calculator cafe astrology,170
birth chart calculator vedic,170
birth chart calendar,170
birth chart compatibility app,170
birth chart compatibility for marriage free,170
birth chart compatiblity,170
birth chart costar,170
birth chart daily horoscope,170
birth chart degrees,170
birth chart fre,170
birth chart house,170
birth chart look up,170
birth chart map,170
birth chart meanings,170
birth chart moon sign,170
birth chart necklace,170
birth chart prediction,170
birth chart read,170
birth chart relationship compatibility,170
birth chart whole sign,170
birth chart zodiac sign,170
birth element chart,170
birth gem chart,170
birth planet chart,140
birth shell chart,140
birth weight percentile chart,140
birthing ball size chart,140
blac chyna birth chart,140
bo burnham birth chart,140
bob marley birth chart,140
brendan fraser birth chart,140
bretman rock birth chart,140
cameron diaz birth chart,140
celine dion birth chart,140
chart birth,140
chelsea handler birth chart,140
chinese birth chart 2021,140
chinese birth chart accuracy,140
chinese birth year chart,140
chinese year birth chart,140
chloe cherry birth chart,140
chris hemsworth birth chart,140
chris pine birth chart,140
colleen love is blind birth chart,140
comparing birth chart,140
comparing birth charts,140
complete birth chart,140
crystal child birth chart,140
dave chappelle birth chart,140
ddg birth chart,140
denzel washington birth chart,140
detailed birth chart,140
dixie d'amelio birth chart,140
donald glover birth chart,140
draconic birth chart meaning,140
dwayne johnson birth chart,140
elizabeth olsen birth chart,140
ellen degeneres birth chart,140
emilia clarke birth chart,140
enya umanzor birth chart,140
francesca farago birth chart,140
free birth chart compatibility for marriage,140
free birth chart online,140
free birth chart reading 2022,140
free birth chart with houses,140
free zodiac birth chart,140
full astrological birth chart,140
gabbie hanna birth chart,140
generate birth chart,140
glorilla birth chart,140
halle berry birth chart,140
hasan piker birth chart,140
hillary clinton birth chart,140
hoshi birth chart,140
how to read a birth chart pdf,140
how to read birth chart houses,140
how to read birth chart wheel,140
hugh hefner birth chart,140
ian somerhalder birth chart,140
indian birth chart,140
induce labor birth ball positions chart,140
jack black birth chart,140
james charles birth chart,140
james franco birth chart,140
jayda cheaves birth chart,140
jeffrey epstein birth chart,140
jenna marbles birth chart,140
jennifer garner birth chart,140
jesse rutherford birth chart,140
jessica alba birth chart,140
jimi hendrix birth chart,140
jimmy fallon birth chart,140
jonah hill birth chart,140
joseline hernandez birth chart,140
juno in birth chart,140
jupiter retrograde birth chart,140
jupiter retrograde in birth chart,140
just astrology things birth chart,140
kaia gerber birth chart,140
kelly clarkson birth chart,140
kenya moore birth chart,140
kid cudi birth chart,140
king von birth chart,140
kkvsh birth chart,140
kodak black birth chart,140
korean birth flower chart,140
kyle richards birth chart,140
latto birth chart,140
lea michele birth chart,140
lil kim birth chart,140
lil uzi birth chart,140
liz truss birth chart,140
logan paul birth chart,140
louis tomlinson birth chart,140
madelyn cline birth chart,140
malcolm x birth chart,140
marilyn manson birth chart,140
mark zuckerberg birth chart,140
meryl streep birth chart,140
miles teller birth chart,140
moon birth chart,140
my free birth chart,140
my natal birth chart,140
natal birth chart astrology,140
natasha lyonne birth chart,140
niall horan birth chart,140
nikola tesla birth chart,140
nina dobrev birth chart,140
obama's birth chart,140
oprah winfrey birth chart,140
past life birth chart,140
paul mccartney birth chart,140
pink birth chart,140
playing card birth chart,140
reese witherspoon birth chart,140
rising sign on birth chart,140
robert downey jr birth chart,140
rupaul birth chart,140
salma hayek birth chart,140
sam smith birth chart,140
sarma melngailis birth chart,140
selena birth chart,140
shania twain birth chart,140
sofia vergara birth chart,140
solange birth chart,140
soulmate birth chart,140
soulmate birth chart calculator free,140
starseed birth chart,140
sylvia plath birth chart,140
tems birth chart,140
teyana taylor birth chart,140
tiffany pollard birth chart,140
tim burton birth chart,140
tom hardy birth chart,140
trevor noah birth chart,140
twin flame birth chart,140
u.s. birth rate chart,140
understanding your birth chart,140
vinny guadagnino birth chart,140
who is my perfect match according to birth chart,140
whole sign house birth chart,140
wiz khalifa birth chart,140
yod birth chart,140
yod in birth chart,140
yung gravy birth chart,140
13th zodiac sign birth chart,140
aaron rodgers birth chart,140
al pacino birth chart,140
alabe free birth chart,140
alba baptista birth chart,140
amber rose birth chart,140
andre 3000 birth chart,140
angus cloud birth chart,140
anya taylor joy birth chart,140
aoc birth chart,140
