Keyword,Frequency
evaporation line on pregnancy test,8100
evaporation line pregnancy test,6600
pregnancy test evaporation line,5400
jenelle evans mom barbara,4400
eva lovia pregnant,2900
evap line on pregnancy test,2400
nevada abortion law,1600
evap line pregnancy test,1300
evaporation line positive faint pregnancy line,1300
kelly evans pregnant,1300
selena gomez pregnant with chris evans,1300
eva notty mom,1000
how long does bbt stay elevated if pregnant,1000
is eva longoria pregnant,1000
kelly evans pregnancy,1000
eva longoria pregnant,880
evan ross father,880
evaporated milk baby formula,880
how to make baby formula with evaporated milk,880
is abortion legal in nevada,880
eva adams mom,720
eva longoria pregnant 2023,720
eva marcille pregnant,720
eva notty pregnant,720
eva notty step mom,720
evaporation lines pregnancy test,720
kelly evans baby,720
nevada abortion,720
walmart pregnancy test evap line,720
chris evans birth chart,590
chris evans dad,590
elevated afp in pregnancy,590
elevated heart rate pregnancy,590
elevated liver enzymes in pregnancy,590
eva mendes pregnant,590
evaporation line on a pregnancy test,590
evaporation line on walmart pregnancy test,590
is kelly evans pregnant,590
jenelle evans mom,590
walmart pregnancy test evaporation line,590
abortion in nevada,590
chris evans mom,480
elevated afp pregnancy,480
elevated wbc in pregnancy,480
evaporation lines on pregnancy test,480
nevada abortion laws,480
nevada spca adoption,480
pregnancy evaporation line,480
stevanna jackson mother,480
suzanne marie sevakis mother,480
teva birth control,480
adoption in nevada,480
clear blue pregnancy test evap line,390
clear blue pregnancy test evaporation line,390
ectopic pregnancy dilation and evacuation,390
equate pregnancy test evap line,390
eva marcille father,390
evap line on clearblue pregnancy test,390
evap line on equate pregnancy test,390
evap line on walmart pregnancy test,390
evap line pregnancy,390
evaporation line clear blue pregnancy test,390
evaporation line on clear blue pregnancy test,390
evaporation line on equate pregnancy test,390
mike evans dad,390
mike evans mom,390
nevada abortion rights,390
nevada humane society adoption,390
suzanne sevakis daughter megan father,390
suzanne sevakis mother,390
what is an evap line on pregnancy test,390
18 father capodanno boulevard,390
603 mother gaston boulevard,390
625 father capodanno boulevard,390
brevard focus parent portal,320
clear blue evaporation line on pregnancy test,320
devan duniver mother,320
elevated blood pressure pregnancy,320
elevating hips to get pregnant,320
eva braun date of birth,320
evap line clear blue pregnancy test,320
evap line equate pregnancy test,320
evap line on first response pregnancy test,320
evap lines on clear blue pregnancy test,320
evap pregnancy line,320
father lucas trevant,320
how long after egg retrieval is frozen embryo transfer,320
pregnancy elevated heart rate,320
pregnancy evap line,320
selena gomez chris evans baby,320
spca of northern nevada shelter adoption,320
suzanne sevakis first pregnancy,320
tiffany evans father can you hear me,320
blackish baby devante dies,260
brevard parent portal,260
dilation and evacuation abortion,260
eva notty mom pov,260
evan mcmullin abortion,260
evan ross dad,260
evap line first response pregnancy test,260
evaporated pregnancy line,260
evaporation line first response pregnancy test,260
evaporation line pregnancy,260
false positive rexall pregnancy test evaporation line,260
father can you hear me tiffany evans,260
father capodanno boulevard,260
first response pregnancy test evaporation line,260
gladys guevarra baby,260
heart evangelista pregnant,260
heart rate elevated pregnancy,260
how many days after egg retrieval is embryo transfer,260
is eva marcille pregnant,260
lacey evans baby,260
selena gomez and chris evans pregnant,260
abreva pregnancy,260
alina kabaeva pregnant,260
are abortions legal in nevada,260
baby tevas,210
blue dye pregnancy test evap line,210
can i use abreva while pregnant,210
can you use abreva while pregnant,210
chris evans and selena gomez baby,210
devaughn nixon mother,210
elevated alpha fetoprotein in pregnancy,210
elevated d dimer in pregnancy,210
elevated wbc and neutrophils in pregnancy,210
eva amurri how i met your mother,210
eva mendes mom,210
eva notty my friends hot mom,210
evan mobley dad,210
evap line pregnancy test clear blue,210
evap on pregnancy test,210
evap pregnancy test,210
evaporated pregnancy test,210
evaporation line false positive pregnancy test,210
evaporation line on blue dye pregnancy test,210
evaporation line on pregnancy test first response,210
evaporation line pregnancy test clear blue,210
evaporation pregnancy test,210
focus parent portal brevard,210
geneva woods birth center,210
how long after egg retrieval is embryo transfer,210
hungry mother state park park boulevard marion va,210
is abortion legal in nevada 2022,210
nevada alexander musk date of birth,210
nevaeh buchanan mother,210
pregnancy test evap,210
pregnancy test evap line,210
shay evans mom,210
slightly elevated afp in pregnancy,210
teen mom jenelle evans,210
the circumstances of one's birth are irrelevant,210
what does evans dad do in tell me lies,210
who is evans father on chesapeake shores,210
1 father devalles blvd,210
abortion laws in nevada,210
alexia echevarria mom,210
alk phos elevated in pregnancy,210
alkaline phosphatase elevated in pregnancy,210
alpha fetoprotein elevated in pregnancy,210
blue evaporation line on pregnancy test,170
blue evaporation line pregnancy test,170
blue pregnancy test evap line,170
blue pregnancy test evaporation lines,170
chris evans father,170
cvs pregnancy test evap line,170
d dimer elevated pregnancy,170
elevans dad,170
elevated alk phos in pregnancy,170
elevated blood pressure in pregnancy,170
elevated blood pressure in pregnancy icd 10,170
elevated hcg not pregnant,170
elevated white blood cell count pregnancy,170
eva long mom,170
eva mae antwone fisher mother,170
eva pilgrim father,170
evan storms dad,170
evangeline lilly pregnant,170
evangelion dad,170
evap line on blue dye pregnancy test,170
evap line on rexall pregnancy test,170
evaporation line on rexall pregnancy test,170
evaporation lines on first response pregnancy test,170
father capodanno boulevard staten island ny,170
father rocky relevant radio,170
how many days after egg retrieval is frozen embryo transfer,170
is abortion illegal in nevada,170
is kelly evans pregnant again,170
mike evans father,170
mom clevage,170
nevaeh arnett fake pregnancy,170
parenting evaluation,170
prevacid pregnancy,170
rexall pregnancy test evap line,170
rexall pregnancy test evaporation line,170
1 father devalles boulevard,170
841 father capodanno boulevard,170
abortion law in nevada,170
abortion nevada,170
blue dye pregnancy test evap line or positive,140
chris evans dad dentist,140
elevated hcg levels not pregnant,140
eva angelina pregnant,140
eva lovia mom,140
eva lovie pregnant,140
eva notty friends mom,140
evan and katelyn pregnant,140
evan ross mom,140
faith evans mom,140
faith evans mother,140
homemade infant formula recipe evaporated milk,140
infant annihilator the elysian grandeval galèriarch,140
kelly evans cnbc pregnant,140
lacey evans pregnant,140
mother mousse victory boulevard,140
nevada abortion clinics,140
nevada adoption,140
spca of brevard adoption,140
who is evan ross father,140
who is the father of evan ross,140
24 mother gaston boulevard,140
abortion clinics in nevada,140
abreva while pregnant,140
brevard humane society adoption,140
chris evans date of birth,110
deva prenatal,110
elevated liver enzymes 36 weeks pregnant,110
elevated liver enzymes in infant breastfeeding,110
eva marie dad,110
eva mendes birth chart,110
evan funke mother wolf,110
evan rachel wood pregnant,110
evantubehd dad,110
faith evans father,110
i am the mother of evangeline,110
jace evans father,110
nevada abortion week limit,110
ocean breeze athletic complex father capodanno boulevard staten island ny,110
parent portal geneva,110
relevant radio father rocky,110
suzanne sevakis michael hughes father,110
who is the father of lacey evans baby,110
