Keyword,Frequency
how many weeks pregnant for due date,5400
baby due date,3600
due date based on conception,3600
royal baby number 4 due date,2900
conception date due date,2400
due date by conception,2400
conception date based on due date,1900
signs baby is coming before due date,1900
free baby gender predictor by due date,1600
jonathan scott baby due date,1600
due date based on conception date,1000
due date base on conception,880
due date based conception date,880
how many weeks pregnant am i based on due date,720
due date from conception,590
embryo transfer due date,590
calculate baby due date,480
calculate due date by conception,480
conception due date,480
conception to due date,480
date of conception based on due date,480
date of conception due date,480
due date by conception date,480
due date conception date,480
tarek el moussa baby due date,480
weeks pregnant by due date,480
calculate due date based on conception date,390
calculate due date by conception date,390
conception and due date,390
conception date due,390
frozen embryo transfer due date,390
calculate conception date from due date,320
conception date and due date,320
conception date by due date,320
conception due date chart,320
drew scott baby due date,320
due date when was conception,320
how many weeks pregnant am i by due date,320
pregnant due date,320
baby due date predictor,260
calculate due date from conception,260
conception date to due date,260
conception due date calendar,260
is chanel west coast pregnant due date,260
6 weeks pregnant due date,260
baby due date calendar,260
baby due date pool,260
calculate conception based on due date,210
calculate due date from conception date,210
chanel west coast baby due date,210
conception based on due date,210
conception month due date,210
due date by conception day,210
how many weeks pregnant based on due date,210
5 weeks pregnant due date,210
8 weeks pregnant due date,210
conception calendar due date,170
conception date from due date,170
conception to due date chart,170
due date conception,170
due date conception calendar,170
due date from conception date,170
how many weeks pregnant by due date,170
if i'm 10 weeks pregnant when is my due date,170
ivf frozen embryo transfer due date,170
miscarriage due date quotes,170
trisha paytas pregnant due date,170
weeks pregnant based on due date,170
april conception due date,170
conception and due date chart,140
conception month to due date,140
conception vs due date,140
due date conception chart,140
due date vs conception,140
how pregnant am i based on due date,140
how to calculate pregnant due date,140
if im 8 weeks pregnant when is my due date,140
sophie turner pregnant due date,140
11 weeks pregnant due date,140
4 weeks pregnant due date,140
5 day embryo transfer due date,140
7 weeks pregnant due date,140
9 weeks pregnant due date,140
calculate due date based on conception,110
calculate weeks pregnant by due date,110
chrissy teigen pregnant due date,110
conception date vs due date,110
due date based off conception,110
due date by date of conception,110
due date if pregnant today,110
due date to conception date,110
frozen embryo transfer calendar due date,110
how to calculate due date from conception,110
october conception due date,110
