Keyword,Frequency
target baby registry,246000
amazon baby registry,201000
buy buy baby registry,90500
baby registry,74000
amazon baby registry search,49500
walmart baby registry,40500
baby registry amazon,27100
target baby registry search,18100
target registry baby,14800
baby registry search,9900
baby registry target,9900
amazon registry baby,9900
baby registry checklist,8100
baby registry must haves,8100
find target baby registry,8100
baby registry finder,5400
amazon baby shower registry,4400
baby registry list,4400
buybuy baby registry,4400
pottery barn baby registry,4400
target baby registry search by name,4400
target baby shower registry,4400
amazon baby registry welcome box,4400
baby shower registry,3600
best baby registry,3600
buy buy baby registry search,3600
walmart baby registry search,3600
find baby registry,2900
walmart baby registry box,2900
amazon baby registry search by name,2900
best baby registry sites,2400
target baby registry login,2400
target baby registry lookup,2400
target.com baby registry,2400
walmart registry baby,2400
amazon baby registry discount,2400
baby registry walmart,1900
buy buy baby gift registry,1900
find a baby registry,1900
find amazon baby registry,1900
target baby gift registry,1900
target baby registry checklist,1900
what to put on baby registry,1900
amazon baby registry lookup,1900
baby gift registry,1600
baby registry checklist 2022,1600
baby registry must haves 2022,1600
bye bye baby registry,1600
must have baby registry items,1600
pottery barn kids baby registry,1600
baby registry essentials,1300
baby registry items,1300
free baby registry box,1300
must haves for baby registry,1300
target baby registry welcome kit,1300
www.buybuybaby.com baby registry,1300
amazon.com baby registry,1300
baby list find a registry,1000
target gift registry baby,1000
the bump baby registry,1000
baby list registry search,880
baby registry ideas,880
best baby registry items,880
buy buy baby registry gift,880
buybuybaby baby registry,880
what is a baby registry,880
what to put on a baby registry,880
baby registry sites,720
bed bath and beyond baby registry,720
buy buy baby baby registry,720
buybuy baby gift registry,720
by by baby registry,720
crate and barrel baby registry,720
how to find a baby registry on amazon,720
nordstrom baby registry,720
online baby registry,720
target baby registry discount,720
walmart baby registry welcome box,720
amazon baby registry checklist,720
amazon baby registry completion discount,720
baby list registry,590
buy buy baby registry discount,590
costco baby registry,590
how to find baby registry on amazon,590
how to make a baby registry on amazon,590
minimalist baby registry,590
sample baby registry,590
target baby registry find,590
things to put on baby registry,590
what to add to baby registry,590
baby r us registry,480
baby registry lookup,480
baby registry websites,480
baby shower registry list,480
buy baby registry,480
buy but baby registry,480
lakelyn doyle baby registry,480
second baby registry,480
target baby registry gift,480
target baby registry welcome kit 2022,480
target registry baby shower,480
top baby registry items,480
top baby registry items 2022,480
walmart baby registry lookup,480
walmart.com baby registry,480
amazon find baby registry,480
amazon prime baby registry,480
babies r us baby registry,480
baby registry at target,390
baby registry greeting message,390
baby registry list ideas,390
baby registry message,390
baby registry must haves 2023,390
baby registry search by name,390
baby registry welcome box,390
baby registry.com,390
best place for baby registry,390
best places for baby registry,390
but buy baby registry,390
buy baby buy registry,390
buy buy baby find registry,390
buy buy baby registry completion discount,390
carters baby registry,390
enfamil baby registry,390
kohl's baby registry,390
my baby registry,390
search amazon baby registry,390
target baby registry completion discount,390
target baby registry finder,390
target.com registry baby,390
things to add to baby registry,390
baby registry buy buy baby,320
baby registry checklist pdf,320
baby registry freebies,320
baby registry options,320
babylist baby registry,320
create baby registry,320
how to make a baby registry,320
kohls baby registry,320
macy's baby registry,320
must haves on baby registry,320
myregistry baby,320
registry baby,320
target baby registry app,320
target find baby registry,320
what is baby registry,320
what to put on your baby registry,320
when to start baby registry,320
zola baby registry,320
amazon baby registry returns,320
baby registry check list,260
baby registry etiquette,260
baby registry greeting,260
baby target registry,260
burlington baby registry,260
buy buy baby find a registry,260
buy buy baby registry look up,260
buybuy baby baby registry,260
buybuy baby registry search,260
essentials for baby registry,260
find baby registry target,260
free baby registry gifts,260
how many items should be on a baby registry,260
how to create a baby registry on amazon,260
ikea baby registry,260
kanna byers baby registry,260
kanna byers baby registry amazon,260
natalie scott baby registry,260
registry checklist baby,260
similac baby registry,260
target baby registry bag,260
target baby registry free gift,260
tyler doyle baby registry,260
universal baby registry,260
walmart baby registry discount,260
walmart baby registry search by name,260
what should i put on my baby registry,260
amazon baby registry find,260
baby registry essentials 2022,210
baby registry examples,210
baby registry must have,210
baby registry needs,210
baby registry thank you message,210
baby registrys,210
baby shower registry search,210
best buy baby registry,210
buy buy baby registry login,210
essential baby registry items,210
etsy baby registry,210
