Keyword,Frequency
ari lennox birth chart,140
ashanti birth chart,140
astro cafe astrology birth chart,140
astro com birth chart interpretation,140
astro seek birth chart compatibility,140
astro-charts birth chart,140
astrolada birth chart calculator,140
ateez birth charts,140
bang chan birth chart,140
best birth chart app,140
bethenny frankel birth chart,140
big three birth chart,140
biggie smalls birth chart,140
bill clinton birth chart,140
birth chart astrology compatibility,140
birth chart astroseek,140
birth chart big 3,140
birth chart caculator,140
birth chart calculater,140
birth chart calculator moon sign,140
birth chart compatibility with time,140
birth chart compatibility with times,140
birth chart compatibilty,140
birth chart example,140
birth chart free astrology,140
birth chart in tamil,140
birth chart interpretation free,140
birth chart interpreter,140
birth chart just astrology,140
birth chart lilith,140
birth chart no time,140
birth chart shapes,140
birth chart soulmate,140
birth chart today,140
birth chart website,140
birth chart with asteroids,140
birth chart zodiac calculator,140
birth charts explained,140
birth chartt,140
birth charty,140
birth gemstone chart,140
birth gender chart,140
birth month color chart,140
birth order chart,140
blank birth chart,140
blue ivy birth chart,140
bobby brown birth chart,140
bradley cooper birth chart,140
bruce lee birth chart,140
cafe birth chart,110
candace owens birth chart,110
caresha birth chart,110
carl jung birth chart,110
celebrity birth chart compatibility,110
chester bennington birth chart,110
chicago west birth chart,110
childish gambino birth chart,110
chinese birth chart gender,110
christina ricci birth chart,110
compare birth charts free,110
compatibility birth charts,110
compatibility zodiac birth chart,110
co--star birth chart,110
couple birth chart,110
dababy birth chart,110
daniel radcliffe birth chart,110
dave grohl birth chart,110
devin booker birth chart,110
dominic fike birth chart,110
ed sheeran birth chart,110
eddie murphy birth chart,110
edgar allan poe birth chart,110
elton john birth chart,110
ethereal astrology birth chart,110
extended birth chart,110
free birth chart astrotheme,110
free birth chart compatibility report with birth times,110
free birth chart generator,110
frida kahlo birth chart,110
gabrielle union birth chart,110
ghislaine maxwell birth chart,110
gunna birth chart,110
gwyneth paltrow birth chart,110
hayden christensen birth chart,110
how to find out your birth chart,110
how to make a birth chart,110
how to read a birth chart wheel,110
ice cube birth chart,110
j.k. rowling birth chart,110
jackson wang birth chart,110
jada pinkett birth chart,110
jada smith birth chart,110
jake paul birth chart,110
jamie foxx birth chart,110
jamie lee curtis birth chart,110
jane fonda birth chart,110
jeff buckley birth chart,110
jensen ackles birth chart,110
jeremy allen white birth chart,110
jfk birth chart,110
jk rowling birth chart,110
joaquin phoenix birth chart,110
jodi arias birth chart,110
joe jonas birth chart,110
judge judy birth chart,110
kai the hitchhiker birth chart,110
kandi burruss birth chart,110
karol g birth chart,110
kate hudson birth chart,110
kate winslet birth chart,110
kelly rowland birth chart,110
kesha birth chart,110
kevin samuels birth chart,110
klay thompson birth chart,110
kristin cavallari birth chart,110
lakeith stanfield birth chart,110
lauren conrad birth chart,110
lenny kravitz birth chart,110
liam payne birth chart,110
lili reinhart birth chart,110
lisa bonet birth chart,110
lisa rinna birth chart,110
lisa vanderpump birth chart,110
low birth weight baby weight gain chart,110
maren altman birth chart,110
markiplier birth chart,110
marlon brando birth chart,110
martha stewart birth chart,110
mary j blige birth chart,110
matt rife birth chart,110
mayan birth chart,110
messi birth chart,110
miguel birth chart,110
miranda cosgrove birth chart,110
monica bellucci birth chart,110
mrbeast birth chart,110
namjoon birth chart,110
nas birth chart,110
natalie nunn birth chart,110
ned fulmer birth chart,110
nene leakes birth chart,110
neymar birth chart,110
nia long birth chart,110
nicole richie birth chart,110
noah beck birth chart,110
noah cyrus birth chart,110
normani birth chart,110
omar apollo birth chart,110
ozzy osbourne birth chart,110
p diddy birth chart,110
pablo escobar birth chart,110
paul mescal birth chart,110
paul rudd birth chart,110
paul wesley birth chart,110
personal birth chart,110
pleiadian starseed birth chart,110
pop smoke birth chart,110
priyanka chopra birth chart,110
queen latifah birth chart,110
rauw alejandro birth chart,110
raven symone birth chart,110
read birth chart,110
relationship birth chart,110
russell brand birth chart,110
russell wilson birth chart,110
shane dawson birth chart,110
skin diamond birth chart,110
star sign birth chart,110
starseed birth chart calculator,110
steph curry birth chart,110
sun moon rising birth chart,110
synastry birth chart,110
taika waititi birth chart,110
theo james birth chart,110
theo von birth chart,110
tina turner birth chart,110
tom hanks birth chart,110
tracee ellis ross birth chart,110
trey songz birth chart,110
trixie mattel birth chart,110
twin flame birth chart calculator astrotheme,110
txt birth charts,110
tyler perry birth chart,110
understanding my birth chart,110
united states birth chart,110
vedic astrology birth chart free,110
vedic birth chart analysis,110
vedic birth chart interpretation,110
venus birth chart,110
victoria beckham birth chart,110
victoria pedretti birth chart,110
wealth birth chart calculator,110
what does my birth chart say about me,110
what is birth chart,110
what my birth chart,110
what starseed am i birth chart,110
whole sign houses birth chart,110
whole signs birth chart,110
your birth chart,110
zelensky birth chart,110
zodiac birth chart compatibility,110
zooey deschanel birth chart,110
