Keyword,Frequency
adopt a pet,165000
pet adoption near me,49500
pet adoption,27100
adopt me pets,22200
adopt a pet near me,18100
pete davidson dad,14800
petsmart adoption,14800
pets for adoption near me,12100
petco adoption,8100
pets for adoption,8100
pipette baby,8100
pete davidson mom,6600
petite mother of the bride dresses,6600
free pet adoption near me,5400
pet adoption centers near me,5400
pet for adoption near me,5400
petsmart cat adoption,5400
pete davidson father,4400
adopt me pet values,4400
adopt pet,4400
free adopt me pets,3600
pet adoption events near me,3600
pet adoption service,3600
pets near me for adoption,3600
pets to adopt near me,3600
petsmart adoption events,3600
adopt a pet com,3600
adopt a pet.com,3600
adopt pets,3600
kim kardashian pete davidson baby,2900
mother of bride dresses petites,2900
pet adoption center,2900
pet adoption center near me,2900
petco cat adoption,2900
petsmart dog adoption,2900
adopt me pet,2900
adopt me pet names,2900
adoption pets near me,2900
bush baby pet,2400
cats for adoption at petsmart,2400
pet adoption near me free,2400
pet adoption websites,2400
petco pet adoption,2400
pete davidson kim kardashian pregnant,2400
pete davidsons dad,2400
pete davidson's dad,2400
peter doocy baby,2400
rehome adopt a pet,2400
rose petal lips baby,2400
spet mom xxx,2400
adopt me free pets,2400
adopt me pet value,2400
adopt me pets for sale,2400
adopt pets near me,2400
adoption pet,2400
pet adoption houston,1900
pet adoption san antonio,1900
petco adoption events,1900
petite mother of the bride dress,1900
pets adoption near me,1900
petsmart cats for adoption,1900
petsmart pet adoption,1900
second chance pet adoption,1900
adopt a dog from petsmart,1900
adopt a pet events near me,1900
adopt a pet fenton,1900
adopt me bear pet,1900
adopt pet near me,1900
homeward bound pet adoption center,1600
me as a baby puppet,1600
pet adoption centers,1600
peter doocy father,1600
wags pet adoption,1600
adopt a pet for free near me,1600
adopt a pet houston,1600
adopt me pets pictures,1600
baby pete,1300
buy adopt me pets,1300
free pet adoption,1300
harker heights pet adoption center photos,1300
homeward pet adoption center,1300
how to get free pets in adopt me,1300
loss of appetite early pregnancy no morning sickness,1300
mother of bride dresses petite,1300
mother of perpetual help,1300
mother of perpetual help novena,1300
novena to our mother of perpetual help,1300
pet adoption chicago,1300
pet adoption las vegas,1300
pet adoption san diego,1300
pet smart adoption,1300
pete davidson dad 911,1300
pete davidson kim kardashian baby,1300
petite mother of the groom dresses,1300
pets adoption centers near me,1300
petsmart adoption weekend 2022,1300
rarest pet in adopt me,1300
san antonio pet adoption,1300
scottish pets adopt me,1300
star pets adopt me,1300
what is the rarest pet in adopt me,1300
what is the rarest pets in adopt me,1300
adopt a pet chicago,1300
adopt a pet los angeles,1300
adopt a pet website,1300
all adopt me pets,1300
baby shower appetizers,1000
cats for adoption at petco,1000
is loss of appetite a sign of pregnancy,1000
loss of appetite early pregnancy,1000
loss of appetite pregnancy,1000
mom and pops petersburg il,1000
mother of the bride dresses petite,1000
mother of the bride petite dresses,1000
orange county pet adoption,1000
pet adoption denver,1000
pet adoption org,1000
pet adoption orlando,1000
pet for adoption,1000
pet smart adoption day,1000
peta jensen step mom,1000
pete davidson birth chart,1000
pete davidsons mom,1000
peter quill dad,1000
petite mother of bride dresses,1000
pets to adopt,1000
petsmart adopt,1000
petsmart adoption days,1000
petsmart adoption event,1000
petsmart dogs for adoption,1000
roblox adopt me pets,1000
york adopt a pet,1000
adopt a pet .com,1000
adopt a pet nyc,1000
adopt apet,1000
adopt me japan egg pets,1000
adopt me pets name,1000
adopt me pets names,1000
adopt me pets value,1000
adopt pet shelter,1000
adoption pet center near me,1000
adoption pets,1000
austin pet adoption,1000
baby monkey pet,880
dallas pet adoption,880
increased appetite early pregnancy,880
industry baby trumpet,880
miami dade pet adoption,880
miami-dade animal services pet adoption & protection center photos,880
michigan abortion petition,880
mother of perpetual help prayer,880
our mother of perpetual help,880
pet adoption los angeles,880
pet adoption miami,880
pet adoption nyc,880
peta jensen step mother and son,880
petco dog adoption,880
pete davidson baby joke,880
pete davidsons father,880
pete davidson's father,880
pete davidson's mom,880
pete wentz mom,880
peter quill's dad,880
petfinder dog adoption,880
petite dresses for mother of the bride,880
petite mom jeans,880
pets adoption,880
petsmart adoption weekend,880
pet-tracs adoption,880
sacramento pet adoption,880
seattle pet adoption,880
sicsa pet adoption and wellness center,880
sonya peterson mother,880
adopt a pet las vegas,880
adopt a pet san antonio,880
adopt a pet san diego,880
adopt me new pet,880
adopt me pet ages,880
adopt me pet aging,880
adoption center pets,880
adoption centers near me pets,880
adoption pet near me,880
albuquerque pet adoption,880
baby einstein puppets,720
benld adopt a pet,720
birthing scene petroglyph,720
cats for adoption petsmart,720
chicago pet adoption,720
evan peters birth chart,720
gabby petito mom,720
home to home pet adoption,720
joe peters mother,720
lily peters mother and father,720
mary s. roberts pet adoption center,720
miami-dade animal services pet adoption & protection center adoption,720
mother of perpetual help parish,720
new adopt me pets,720
novena to mother of perpetual help,720
pet adoption atlanta,720
pet adoption bay area,720
pet adoption event near me,720
pet adoption events,720
pet adoption kansas city,720
pet adoption phoenix,720
pet adoption st louis,720
pet smart adoption events,720
peter parker birth,720
peter salvino dad,720
petfinder dogs adoption,720
petfinder dogs for adoption,720
petite short mother of the bride dresses,720
petsmart adopt a cat,720
petsmart adoption dogs,720
petsmart animal adoption,720
petsmart kitten adoption,720
pregnant no appetite,720
rose petal lips on baby,720
st charles county pet adoption center,720
whippet adoption,720
woodland egg adopt me pets,720
you as a baby puppet,720
adopt a pet denver,720
adopt a pet for free,720
adopt me legendary pets,720
adopt me pet list,720
adopt me pet value list,720
adopt me pets for free,720
adopt me woodland egg pets,720
adopt pets for free,720
baby fell off bed onto carpet,590
baby peter pan costume,590
baby yoda chia pet,590
fort worth pet adoption,590
free pet adoption arizona,590
great plains spca pet adoption center,590
harker heights pet adoption center,590
houston pet adoption,590
how did pete davidson dad die,590
how did pete davidson dad died,590
how did pete davidsons dad die,590
humane society pet adoption,590
hurricane ian pets for adoption,590
jesus heals peter's mother in law,590
loss of appetite during pregnancy,590
miss winkles pet adoption center adoption,590
mother of the bride pant suits petite,590
nashville pet adoption,590
neon adopt me pets,590
no appetite during pregnancy,590
ocnetpets adoption,590
pet adopt,590
pet adoption colorado springs,590
pet adoption ct,590
pet adoption jacksonville fl,590
pet adoption okc,590
pet adoption organization,590
pet adoption pittsburgh,590
pet adoption services,590
pet adoption sites,590
pet adoption utah,590
petco adoption days 2022,590
petco animal adoption,590
petco cats for adoption,590
pete buttigieg baby,590
pete davidson date of birth,590
pete davidson father 9/11,590
pete davidson mother,590
peter griffin dad,590
peter rabbit baby shower,590
petite mother of the bride pantsuits,590
pets for free adoption,590
petsmart adoption events near me,590
petsmart adoption week,590
pipette baby balm,590
pipette baby lotion,590
pipette baby shampoo,590
pregnant no appetite but hungry,590
rare adopt me pets,590
rarest pets in adopt me,590
san jose pet adoption,590
saving grace pet adoption center,590
spca pet adoption,590
st louis county pet adoption center,590
starpets adopt me,590
unleashed pet rescue and adoption,590
what is the best pet in adopt me,590
what's the rarest pet in adopt me,590
adopt a pet atlanta,590
adopt a pet miami,590
adopt a pet michigan,590
adopt a pet naperville,590
adopt a pet orlando,590
adopt a pet phoenix,590
adopt a pet shelter,590
adopt a pet victoria tx,590
adopt me new pets,590
adopt me pet drawings,590
adopt me pet value list 2022,590
adopt me pets legendary,590
adoption pet centers near me,590
baby carpet beetle,480
best pet in adopt me,480
dog pregnancy test petco,480
early pregnancy no appetite no nausea,480
ebay adopt me pets,480
emma roberts and evan peters baby,480
fenton adopt a pet,480
free pet adoption day 2022,480
free pets adopt me,480
free pets for adoption,480
good karma pet adoption center,480
how to adopt a pet in sims 4,480
how to get free pets in adopt me 2023,480
how to make a neon pet in adopt me,480
impetigo infant,480
industry baby trumpet sheet music,480
japan egg pets adopt me,480
kim kardashian pregnant pete davidson,480
lily peters father,480
local pet adoption,480
los angeles pet adoption,480
miami-dade animal services pet adoption & protection center,480
minneapolis pet adoption,480
miss winkles pet adoption center,480
mother of bride short dresses petite,480
mother of the bride dresses short petite,480
national adopt a shelter pet day,480
no appetite early pregnancy,480
nuzzles & co pet rescue and adoption,480
nyc pet adoption,480
oc pet adoption,480
pet adoption charlotte nc,480
pet adoption indianapolis,480
pet adoption league,480
pet adoption near ne,480
pet adoption petsmart,480
pet adoption portland,480
pet adoption tampa,480
pet adoption tulsa,480
pet parent,480
pet to adopt near me,480
peta jensen step mother and son.,480
petco adopt a cat,480
petco adoption cats,480
petco adoption center,480
petco adoption days,480
petco adoption near me,480
pete davidson father 9 11,480
pete davidsons mother,480
peter doocy dad,480
peter griffin mom,480
petfinder com dogs for adoption,480
petit bateau baby,480
petit lem baby,480
petite mother of bride dress,480
petite mother of the bride dresses short,480
petsmart adoption fee,480
petsmart pets for adoption,480
pipette baby wipes,480
repetition is the mother of learning,480
san francisco pet adoption,480
saving grace pet adoption center adoption,480
shelter pets for adoption,480
spcala south bay pet adoption center,480
st charles pet adoption center,480
what is the best pets in adopt me,480
what was the first pet in adopt me,480
who is kim petras mother,480
adopt a pet austin,480
adopt a pet az,480
adopt a pet charlotte nc,480
adopt a pet dallas,480
adopt a pet fargo,480
adopt a pet ma,480
adopt a pet new york,480
adopt a pet rehome,480
adopt a pet sacramento,480
adopt a pet victoria texas,480
adopt a shelter pet,480
adopt me rare pets,480
baby bach puppet,480
baby walker for carpet,390
baby yeti pet,390
baltimore pet adoption,390
best adopt me pets,390
best friends pet adoption,390
boston pet adoption,390
cute adopt me pet names,390
el paso pet adoption,390
free adopt me pet,390
free pets in adopt me,390
how to get free adopt me pets,390
how to get free pets in adopt me 2022,390
is increased appetite a sign of pregnancy,390
jordan peterson abortion,390
kansas city pet adoption,390
las vegas pet adoption,390
legendary pets in adopt me,390
long beach pet adoption,390
loss of appetite early pregnancy 1 week,390
loss of appetite early pregnancy sign,390
mother of the bride petite dress,390
naperville pet adoption,390
novena mother of perpetual help,390
novena of mother of perpetual help,390
peewee's pet adoption,390
pet adopt me,390
pet adoption austin,390
pet adoption baton rouge,390
pet adoption cincinnati,390
pet adoption columbia sc,390
pet adoption events this weekend near me,390
pet adoption fresno,390
pet adoption fund,390
pet adoption louisville ky,390
pet adoption nj,390
pet adoption philadelphia,390
pet adoption rochester ny,390
pet adoption tucson,390
pet shelter adoption,390
pet smart cat adoption,390
pet smart pet adoption,390
pet to adopt,390
petco adopt,390
petco adoption day,390
petco adoption events near me,390
petco kitten adoption,390
pete buttigieg abortion,390
pete buttigieg baby formula,390
pete davidson mom and dad,390
pete wentz brendon urie baby,390
petechiae pregnancy,390
peter quill father,390
petfinder adoption,390
petfinder dogs for adoption near me free,390
petfinders dogs for adoption,390
petite / short mother of the bride dresses,390
petite dresses for mother of the groom,390
petite mom,390
petite mother of the bride,390
petite mother of the bride dresses 2022,390
petite mother of the groom dress,390
petite pant suits for mother of the bride,390
pets in adopt me,390
pets in adoption,390
petsmart adoption cats,390
petsmart adoption day,390
petsmart adoption days 2022,390
petsmart puppy adoption,390
pregnancy petechiae,390
rarest adopt me pet,390
rarest adopt me pets,390
rhode island pet adoption,390
rose petal lip baby,390
san diego pet adoption,390
star pet adopt me,390
what are rose petal lips on a baby,390
whippets for adoption,390
who is peter doocy's father,390
who is peter quill's dad,390
abortion petitions,390
active parent petal,390
adopt a pet boston,390
adopt a pet colorado,390
adopt a pet free,390
adopt a pet ohio,390
adopt a pet pittsburgh,390
adopt a pet tampa,390
adopt a pet victoria,390
adopt me japan egg pets list,390
adopt me pet shop,390
adopt me pet values 2022,390
adopt me pets ages,390
adopt me rarest pets,390
adopt me woodland egg pets list,390
adoption center for pets near me,390
adoption pets nyc,390
all pets in adopt me,390
baby yoda puppet,320
bakersfield pet adoption,320
breastfeeding mom fights off bald eagle to save pet goose,320
cat adoption petco,320
craigslist pets for adoption,320
cute adopt me pets,320
cutest adopt me pets,320
diane's discount pet supplies & adoption center,320
did peter doocy's wife have her baby,320
does petra get pregnant,320
dog adoption petsmart,320
fao schwarz adopt a pet,320
farmington pet adoption center,320
free adopt me pets generator,320
free pet adoption arizona 2022,320
free pet adoption for seniors near me,320
free pet adoption houston,320
gabby petito dad,320
gabby petitos mom,320
halsey and evan peters pregnancy,320
infant peter pan costume,320
is herpetic whitlow an std,320
joshua petersen baby,320
kittens for adoption petsmart,320
legendary adopt me pets,320
lego friends pet adoption cafe,320
lily peters' father,320
loss of appetite during pregnancy 2nd trimester no nausea,320
macys mother of the bride dresses petite,320
miami dade animal services pet adoption,320
miami pet adoption,320
mother of groom dresses petite,320
multcopets adoption,320
neon pet adopt me,320
neon pets adopt me,320
new life pet adoption,320
new pets in adopt me,320
newest pet in adopt me,320
no appetite pregnant,320
no appetite while pregnant,320
one of a kind pet rescue adoption,320
our mother of perpetual help novena,320
pet adoption agency,320
pet adoption albuquerque,320
pet adoption brooklyn,320
pet adoption columbus ohio,320
pet adoption day,320
pet adoption events near me this weekend,320
pet adoption maryland,320
pet adoption nashville,320
pet adoption nc,320
pet adoption network,320
pet adoption oregon,320
pet adoption org crossword,320
pet adoption places near me,320
pet adoption richmond va,320
pet adoption website,320
petco adoption event,320
petco dogs for adoption,320
peter doocy baby due date,320
peter griffin's mom,320
petite dresses mother of the bride,320
petite mother of the bride pant suits,320
petite pregnant,320
petite step mom,320
pets adopt me,320
pets available for adoption near me,320
pets free adoption,320
petsmart adopt a pet,320
petsmart adoption event near me,320
petsmart adoption near me,320
petsmart animals for adoption,320
petsmart charities adoption,320
pipette baby oil,320
preppy adopt me pets,320
reasons for denying pet adoption,320
riverside pet adoption,320
santa monica pet adoption,320
saving grace pet adoption,320
second chance pet adoption league,320
spokane pet adoption,320
tallahassee pet adoption,320
trading adopt me pets,320
unleashed pet rescue adoption,320
what adopt me pet are you,320
where to buy petite mother of the bride dresses,320
whippet for adoption,320
who was pete davidson's dad,320
abortion petition,320
adopt a dog from petco,320
adopt a pet albuquerque,320
adopt a pet baltimore,320
adopt a pet colorado springs,320
adopt a pet columbus ohio,320
adopt a pet fenton mi,320
adopt a pet fort worth,320
adopt a pet humane society,320
adopt a pet inc,320
adopt a pet indianapolis,320
adopt a pet jacksonville fl,320
adopt a pet login,320
adopt a pet minneapolis,320
adopt a pet okc,320
adopt a pet philadelphia,320
adopt a pet rhode island,320
adopt a pet san jose,320
adopt a pet seattle,320
adopt a pet shelton,320
adopt a pet st louis,320
adopt me all pets,320
adopt me custom pets,320
adopt me free pet hacks,320
adopt me neon pets,320
adopt me pet for free,320
adopt me pet room ideas,320
adopt me pet worth,320
adopt me pets free,320
adopt me pets list,320
adopt me roblox pets,320
adoption pet center,320
all the pets in adopt me,320
anchorage pet adoption,320
baby with rose petal lips,260
baton rouge adopt a pet,260
best dresses for petite mother of the bride,260
best friend pet adoption,260
best friends pet adoption center,260
best pet adoption websites,260
best pets in adopt me,260
broward pet adoption,260
cats for adoption petco,260
cleveland pet adoption,260
denver pet adoption,260
detroit pet adoption,260
did peter doocy have his baby yet,260
fenton pet adoption,260
free pet adoption dallas,260
free pet adoption las vegas 2022,260
free pets to adopt,260
homeward bound pet adoption,260
homeward bound pet adoption center adoption,260
homeward bound pet adoption center photos,260
how to draw adopt me pets,260
how to get your dream pet in adopt me,260
humane society pets for adoption,260
if you surrender a pet can you adopt again,260
impetigo baby,260
increased appetite pregnancy,260
irvine pet adoption,260
japan egg adopt me pet list,260
jordan peterson on abortion,260
joshua peterson baby,260
kim petras birth name,260
loss of appetite early pregnancy 2 weeks,260
miami dade animal services pet adoption & protection center fotos,260
mother of bride gowns petite,260
mother of the bride dresses petite size,260
national pet adoption day 2022,260
new york adopt a pet,260
newlife pet adoption,260
nordstrom mother of the bride dresses petite,260
paws pet adoption,260
pet adoption agencies,260
pet adoption agencies near me,260
pet adoption certificate,260
pet adoption dallas,260
pet adoption event,260
pet adoption greenville sc,260
pet adoption maine,260
pet adoption mn,260
pet adoption new orleans,260
pet adoption raleigh nc,260
pet adoption reno,260
pet adoption seattle,260
pet adoption shelter,260
pet adoption weekend,260
pet free adoption,260
pet helpers adoption center and spay neuter clinic,260
pet milk baby formula recipe,260
pet rescue adoption,260
pet rock adopt me,260
pet smart dog adoption,260
petco adopt a pet,260
pete davidson baby,260
pete davidson dad joke,260
pete nance dad,260
petechiae baby,260
peter griffin father,260
peter griffins dad,260
peter pan baby costume,260
petfinder cats for adoption,260
petite plus size mother of the bride dresses,260
petite size mother of the bride dresses,260
petition for abortion rights,260
petland adoption,260
petsmart adoption center,260
petsmart adoption process,260
petsmart dog adoption days,260
pipette baby sunscreen,260
pipette baby wash,260
pittsburgh pet adoption,260
prayer to our mother of perpetual help,260
rutherford county pet adoption and welfare service,260
semopets adoption,260
small pet adoption,260
st louis pet adoption,260
st. charles county pet adoption center,260
star pets adopt me free,260
starpets.gg adopt me,260
successful pregnancy after incompetent cervix,260
uscis parent petition,260
virginia beach pet adoption,260
what are the 14 new pets in adopt me,260
what happens if you break a pet adoption contract,260
what is the most legendary pet in adopt me,260
what is the rarest pet in adopt me 2022,260
what potions can you feed your pet in adopt me,260
what to feed teething baby with no appetite,260
when is peter doocy's baby due,260
where to sign michigan abortion petition,260
woodland pets adopt me,260
5 weeks pregnant no appetite,260
adopt a pet cleveland,260
adopt a pet detroit,260
adopt a pet georgia,260
adopt a pet kansas city,260
adopt a pet louisville ky,260
adopt a pet milwaukee,260
adopt a pet nashville,260
adopt a pet nj,260
adopt a pet petsmart,260
adopt a pet richmond va,260
adopt a pet salt lake city,260
adopt a pet shelter login,260
adopt a pet tucson,260
adopt a rescue pet,260
adopt a shelter pet day,260
adoption for pets,260
appetizers for baby shower,260
atlanta pet adoption,260
aurora adopt a pet,260
baby fell off couch onto carpet,210
best baby walker for carpet,210
broward county pet adoption,210
capital humane society pieloch pet adoption center,210
cheap adopt me pets,210
corpus christi pet adoption,210
dc pet adoption,210
did peter graves and james arness have the same father,210
did peter's wife lose a baby,210
dillards mother of the bride dresses petite,210
dog abortion pill petsmart,210
dog adoption st petersburg fl,210
dogs for adoption at petsmart,210
dogs for adoption petfinder,210
doral pet adoption,210
evan peters mom,210
father peter heers,210
fort wayne pet adoption,210
free adoption pets,210
free pet adoption atlanta,210
gabby petito mother,210
golden paw pet rescue adoption,210
happy mother's day pet mom,210
harris county pet adoption,210
how many pets are in adopt me,210
how to adopt pet sims 4,210
how to get good pets in adopt me,210
increased appetite before period sign of pregnancy,210
is loss of appetite a symptom of pregnancy,210
jacksonville pet adoption,210
japan egg adopt me pets,210
jennifer lawrence pregnant red carpet,210
jordan peterson birth chart,210
kc pet adoption,210
kc pet project zona rosa adoption center,210
kelce mom petition,210
king county pet adoption center,210
kings harvest pet rescue no kill shelter adoption,210
kittens for adoption at petsmart,210
loss of appetite early pregnancy 4 weeks,210
lubbock pet adoption,210
maricopa pet adoption,210
mary s. roberts pet adoption center photos,210
michigan abortion rights petition,210
mother nature pet supply,210
mother of the bride dress petite,210
mother of the bride dresses petite tea length,210
mother of the bride petite size dresses,210
no appetite after birth,210
no appetite pregnancy,210
nordstrom mother of the bride petite dresses,210
nordstrom petite mother of the bride dresses,210
online pet adoption,210
our mother of perpetual help church,210
parent petroleum,210
paul petersen my dad,210
pet adoption app,210
pet adoption boston,210
pet adoption buffalo ny,210
pet adoption colorado,210
pet adoption fort lauderdale,210
pet adoption fort myers,210
pet adoption fort worth,210
pet adoption gainesville fl,210
pet adoption in austin,210
pet adoption knoxville tn,210
pet adoption lincoln ne,210
pet adoption long island,210
pet adoption michigan,210
pet adoption milwaukee,210
pet adoption nh,210
pet adoption orange county,210
pet adoption org crossword clue,210
pet adoption organization crossword clue,210
pet adoption places,210
pet adoption wilmington nc,210
pet adoption wisconsin,210
pet birth certificate,210
pet mom,210
pet mom mothers day,210
pet pal animal shelter adoption,210
pet parent day,210
pet rescue by judy adoption,210
pet store adoption,210
pet supplies plus adoption,210
peta jensen mom,210
peta jenson step mother and son,210
petco animals for adoption,210
petco pets for adoption,210
pete buttigieg on abortion,210
pete davidson dad 9 11,210
pete davidson wants to be a dad,210
pete wentz mother,210
peter parkers dad,210
peter quill mom,210
peter singer abortion,210
peter sleeps with lois mom,210
peters dad,210
peter's mother in law,210
petfinder adopt a dog,210
petite formal dresses mother of the bride,210
petite mother of groom dresses,210
petite mother of the bride dresses tea length,210
petite mother of the bride gowns,210
petite pregnant woman,210
petite pregnant women,210
petition for adoption,210
petland adoption fees,210
pets alive wny dog adoption center,210
petsmart adopt a dog,210
petsmart adopt cats,210
petsmart charities adoption center,210
phoenix pet adoption,210
pieloch pet adoption center,210
prayer to mother of perpetual help,210
pregnancy in petite women,210
pregnant petite,210
preppy adopt me pet names,210
put pet up for adoption,210
rare pets in adopt me,210
rehome by adopt a pet,210
rescue me pet adoption,210
roblox adopt me pet store,210
senior pet adoption,210
shelter pets adoption,210
subaru pet adoption event 2022 near me,210
tea length mother of the bride dresses petite,210
tucson pet adoption,210
utah pet adoption,210
was gabby petito pregnant,210
washington pet adoption,210
what happened to pete davidson dad,210
what's the best pet in adopt me,210
