Keyword,Frequency
whippet puppies for adoption,210
who is pete davidson's dad,210
who is peter dinklage's dad,210
adopt a pet cat,210
adopt a pet cincinnati,210
adopt a pet dog,210
adopt a pet el paso,210
adopt a pet florida,210
adopt a pet fort lauderdale,210
adopt a pet fort wayne,210
adopt a pet miami dade,210
adopt a pet mn,210
adopt a pet new jersey,210
adopt a pet ri,210
adopt a pet rochester ny,210
adopt a pet san francisco,210
adopt a pet tulsa,210
adopt a senior pet month,210
adopt me buy pets,210
adopt me halloween pets 2022,210
adopt me neon pet ages,210
adopt me pet egg,210
adopt me pet pictures,210
adopt me pet stages,210
adopt me pet trade value,210
adopt me rarest pet,210
adopt me surprise plush pets,210
adopt me woodland pets,210
adopt pet shelter near me,210
all the adopt me pets,210
amarillo pet adoption,210
arizona abortion petition,210
arizona pet adoption,210
can loss of appetite be a sign of pregnancy,170
capital humane society pieloch pet adoption center adoption,170
charlotte pet adoption,170
colorado springs pet adoption,170
decreased appetite early pregnancy,170
delaware pet adoption,170
did pete davidson's dad,170
did pete davidsons dad die in 9 11,170
f a o schwarz adopt a pet,170
free adopt me pets no verification,170
free legendary pets in adopt me website,170
free pet adopt me,170
free pet adoption el paso,170
free pet adoption nashville tn,170
free pet adoption rochester ny,170
free pets adoption,170
gabby petito autopsy pregnant,170
good adopt me pets,170
grand rapids pet adoption,170
greenville pet adoption,170
homeward pets adoption center,170
how did pete davidson's dad die,170
how do you make a neon pet in adopt me,170
how much is it to adopt a dog from petsmart,170
how to adopt a pet,170
humane society pet rescue and adoption center,170
is melissa peterman pregnant,170
jeffy mom puppet,170
jeffy's mom puppet,170
jordan peterson father,170
jordan peterson parenting,170
la pet adoption,170
lack of appetite during pregnancy,170
lego pet adoption cafe,170
loss of appetite during pregnancy 2nd trimester,170
loss of appetite during pregnancy 3rd trimester,170
loss of appetite sign of pregnancy,170
maricopa county pet adoption,170
mary roberts pet adoption,170
mary s. roberts pet adoption center services,170
massachusetts pet adoption,170
mcaspets adoption,170
michigan pet adoption,170
montgomery county pet adoption,170
mother of bride petite dresses,170
mother of perpetual help novena prayer,170
mother of the groom dresses for petites,170
mother of the groom dresses petite,170
national pet parent day,170
new adopt me pet,170
new life pet adoption center,170
new york city pet adoption,170
nj pet adoption,170
no appetite during pregnancy 2nd trimester,170
northeast ohio spca pet shelter adoption,170
novena of our mother of perpetual help,170
oakland pet adoption,170
oklahoma city pet adoption,170
orlando pet adoption,170
pensacola pet adoption,170
pet adoption albany ny,170
pet adoption alternative of warren,170
pet adoption arizona,170
pet adoption augusta ga,170
pet adoption birmingham al,170
pet adoption charleston sc,170
pet adoption el paso,170
pet adoption events near me today,170
pet adoption fayetteville nc,170
pet adoption fee waived,170
pet adoption greensboro nc,170
pet adoption in chicago,170
pet adoption in los angeles,170
pet adoption in my area,170
pet adoption in virginia,170
pet adoption indiana,170
pet adoption iowa,170
pet adoption lafayette la,170
pet adoption memphis,170
pet adoption mesa az,170
pet adoption murfreesboro tn,170
pet adoption near me today,170
pet adoption new york,170
pet adoption oahu,170
pet adoption olympia,170
pet adoption organization crossword,170
pet adoption san jose,170
pet adoption site,170
pet adoption springfield mo,170
pet adoption vancouver wa,170
pet dad,170
pet egg adopt me,170
pet owls for adoption,170
pet supplies plus cat adoption,170
pet values adopt me,170
peta jensen step mom and son,170
petco adopt cat,170
petco adoption fee,170
petco cats adoption,170
petco dog adoption days,170
pete davidson dad 9/11,170
pete davidson father 2001,170
pete davidson says its his dream to become a dad,170
pete davidson you never loved me mom,170
pete davidson's dad 9/11,170
petechiae infant,170
peter neal father,170
peter pan your mother and mine,170
peter's mom family guy,170
petfinder adoption dogs,170
petfinders dog adoption,170
petite plus size dresses for mother of the bride,170
petitions for abortion rights,170
pets for adoption at petsmart,170
pets up for adoption near me,170
petsmart bunny adoption,170
petsmart cat adoption fee,170
petsmart cats adopt,170
petsmart dog adoption events,170
petsmart dogs to adopt,170
pictures of adopt me pets,170
rutherford county pet adoption and welfare service adoption,170
saving grace pet adoption center photos,170
scott peterson mother,170
sims 4 adopt a pet,170
sims 4 how to adopt a pet,170
spcala pet adoption center,170
the pet adoption center of orange county,170
uscis petition for parent,170
what are the new pets in adopt me,170
what happened to the mom on petticoat junction,170
what happened to the petersens band father,170
whats the rarest pet in adopt me,170
when does appetite increase in pregnancy,170
woodland egg adopt me pet list,170
9 week fetus in petri dish,170
adopt a monkey pet,170
adopt a neopet,170
adopt a pet benld il,170
adopt a pet birmingham al,170
adopt a pet buffalo ny,170
adopt a pet columbia sc,170
adopt a pet dayton ohio,170
adopt a pet in victoria texas,170
adopt a pet knoxville tn,170
adopt a pet madison,170
adopt a pet orange county,170
adopt a pet rescue login,170
adopt a pet stuffed animals,170
adopt a pet tacoma,170
adopt a pet today,170
adopt a pet utah,170
adopt a pet washington,170
adopt a pet west palm beach,170
adopt a pet.,170
adopt a shelter pet day 2022,170
adopt a virtual pet,170
adopt a.pet,170
adopt free pets,170
adopt me best pets,170
adopt me bluegrass pet rescue,170
adopt me free pet,170
adopt me halloween pets,170
adopt me pet age,170
adopt me pet ebay,170
adopt me pet leveling,170
adopt me pet levels,170
adopt me pet rocks,170
adopt me pet store,170
adopt me pet toys,170
adopt me petd,170
adopt me pets coloring pages,170
adopt me pets pic,170
adopt me pets png,170
adopt me pets value list,170
adopt me.pets,170
adopt pet naperville,170
adopt pet.com,170
adopt petfinder,170
adopt whippet,170
adoption center for pets,170
almost home pet adoption center,170
buying adopt me pets,140
carson peters berger father,140
chattanooga pet adoption,140
christopher pettiet don't tell mom the babysitter's dead,140
collin county pet adoption,140
craigslist pet adoption,140
cuero pet adoption,140
dad joke competition,140
dad pulverizes stepdaughter's petite anus,140
dad puppet,140
des moines pet adoption,140
dorothy o connor pet adoption,140
dorothy o connor pet adoption center,140
el paso free pet adoption,140
evan peters and halsey pregnant,140
every pet in adopt me,140
exotic pet adoption,140
fairy tales pet adoption,140
family guy peter's dad,140
father and son carpet,140
father and son carpet cleaning,140
father pete mccormick,140
find a pet to adopt,140
fort collins pet adoption,140
free adopt me pets websites,140
free pet adoption indianapolis,140
free pets adopt,140
free pets adopt me hack,140
furkids pet adoption & community resource center,140
gabby petito father,140
gateway pet guardians adoption,140
give pet up for adoption,140
great plains spca pet adoption center adoption,140
halo pet adoption,140
happy mothers day pet mom,140
harris county pets adoption,140
home to home pet adoption near me,140
how did pete davidson's dad passed,140
how old was pete davidson when his father passed away,140
how to adopt a cat from petsmart,140
how to adopt pets in sims 4,140
how to get pets in adopt me,140
how to make neon pets in adopt me,140
huntsville pet adoption,140
is adopt a pet legit,140
jeffy's dad puppet,140
joshua pete birth certificate,140
kalamazoo pet adoption,140
kc pet project at kccac adoption,140
kendall pettis dad,140
killeen pet adoption,140
kim kardashian pete davidson pregnant,140
kim kardashian pregnant with pete davidson,140
kim petras mom,140
kourtney kardashian pregnant red carpet,140
la county pet adoption,140
lee county pet adoption,140
lily peters dad,140
lily peters mom,140
local pets for adoption,140
loss of appetite after stopping birth control,140
luella peterson tory lanez mother,140
macys petite mother of the bride dresses,140
madison pet adoption,140
mega adopt me pets,140
miami-dade animal services pet adoption & protection center services,140
mikhaila peterson date of birth,140
miss winkles pet adoption center photos,140
modesto pet adoption,140
mom puppet,140
mom rapetube,140
mother daughter pleasure pets,140
mother of the bride dresses for petites,140
mother of the bride petite,140
mother of the groom petite dresses,140
names for adopt me pets,140
national adopt a shelter pet day 2022,140
national adoption day pet,140
neon pets in adopt me,140
neopets adopt,140
nkla pet adoption center,140
no appetite 2 weeks after giving birth,140
noah pet adoption,140
novena our mother of perpetual help,140
oklahoma pet adoption,140
omaha pet adoption,140
paradise pets adopt me,140
pasadena pet adoption,140
pet adoption alexandria va,140
pet adoption boise,140
pet adoption clarksville tn,140
pet adoption columbia mo,140
pet adoption columbus ga,140
pet adoption fair near me,140
pet adoption form,140
pet adoption henderson nv,140
pet adoption in pa,140
pet adoption in texas,140
pet adoption lexington ky,140
pet adoption missouri,140
pet adoption mobile al,140
pet adoption ohio,140
pet adoption organizations,140
pet adoption papers,140
pet adoption petco,140
pet adoption salt lake city,140
pet adoption staten island,140
pet adoption stores near me,140
pet adoption tacoma,140
pet adoption wichita ks,140
pet dog adoption,140
pet haven cat adoption center,140
pet rats for adoption,140
pet value adopt me,140
peta murgatroyd pregnant,140
petco kittens for adoption,140
petco puppy adoption,140
pete alonso father,140
pete buttigieg father,140
pete davidson black dad,140
pete davidson dad 9/11 memorial,140
pete davidson dad tattoo,140
pete davidson mom age,140
pete davidson wants to be a father its my dream,140
pete nance father,140
peter eats out lois mom,140
peter gabriel father son,140
peter griffins mom,140
peter parker dad,140
peter uihlein dad,140
petfinder dogs for adoption near me,140
petite mother of bride,140
petite mother of the bride outfits,140
petition to reverse adoption,140
petland adoption fee,140
pets adoption center,140
pets for adoption austin,140
pets for adoption petsmart,140
pets for adoption tampa,140
pets value adopt me,140
petsense adoption,140
petsmart adoption event today,140
petsmart adoption hours,140
petsmart kittens adoption,140
petsmart kittens for adoption,140
petsmart near me adoption,140
petsmart pet adoption events,140
petsnpals adoption,140
planned pethood adoption,140
plano pet adoption,140
puppet mom,140
repetition is the father of learning,140
repetition is the mother of skill,140
saint louis county pet adoption center,140
saint louis county pet adoption center adoption,140
san antonio pets alive petco foundation adoption center,140
sarasota pet adoption,140
schabarum park pet adoption,140
sell adopt me pets,140
selling adopt me pets,140
seminole county pet adoption,140
sioux falls pet adoption,140
st charles pet adoption,140
st louis pet adoption center,140
st. charles county pet adoption center photos,140
star pets gg adopt me,140
starpets.ru adopt me,140
tea length petite mother of the bride dresses,140
trade adopt me pets,140
trumpet mother of the bride dresses,140
tulsa pet adoption,140
victoria texas pet adoption,140
wags pet adoption photos,140
wagtopia pet adoption,140
wchspets adoption,140
what is the best pet in adopt me 2022,140
what is the rarest adopt me pet,140
whats the best pet in adopt me,140
which adopt me pet are you,140
woodland egg pets adopt me,140
your mother and mine peter pan,140
37 weeks pregnant loss of appetite and nausea,140
adopt a pet . com,140
adopt a pet admin login,140
adopt a pet arlington tx,140
adopt a pet baton rouge,140
adopt a pet birthday party,140
adopt a pet brooklyn,140
adopt a pet dayton oh,140
adopt a pet fort myers,140
adopt a pet fresno,140
adopt a pet game,140
adopt a pet greenville sc,140
adopt a pet long beach,140
adopt a pet maryland,140
adopt a pet monkey,140
adopt a pet online,140
adopt a pet party,140
adopt a pet raleigh nc,140
adopt a pet reno,140
adopt a pet reviews,140
adopt a pet stockton,140
adopt a pet taylor mi,140
adopt a pet virginia beach,140
adopt a pet york,140
adopt a senior pet,140
adopt a whippet,140
adopt kitten petsmart,140
adopt me christmas pets,140
adopt me legendary pets spin,140
adopt me new pets 2022,140
adopt me pet tier list,140
adopt me pet trade,140
adopt me pet values list,140
adopt me pet vaule,140
adopt me pet wear,140
adopt me pets for sell,140
adopt me pets name list,140
adopt me pets names and pictures,140
adopt me pets rare list,140
adopt me pets rarity list,140
adopt me pets trade,140
adopt me.com free pets,140
adoption petition form,140
alex evenings petite mother of the bride dresses,140
all adopt me pet,140
all new adopt me pets,140
all of the adopt me pets,140
an intoxicated perpetrator can be charged with committing sexual assault,140
animal jam adopt a pet,140
animal shelter pet adoption,140
apa pet adoption,140
asheville pet adoption,140
aspca pet adoption,140
bay area pet adoption,140
birth control increased appetite,140
blank pet adoption certificate free printable,140
desk pet adoption certificate,110
did peter's wife have a miscarriage,110
do you lose appetite when pregnant,110
does birth control increase appetite,110
dogs for adoption near me petfinder,110
dorothy o'connor pet adoption,110
dorothy o'connor pet adoption center,110
dream pets adopt me,110
every adopt me pet,110
fairy tails pet adoption,110
father petar ljubicic,110
father peter,110
father peter harman,110
father peter kovacina,110
father peter sanders,110
father peter villanova,110
father peter wojcik,110
first pet in adopt me,110
free adopt me pets generator 2022,110
free adopt me pets hack,110
free adoption pet,110
free pet adoption dayton ohio,110
free pet adoption orlando,110
friends of the pet adoption center,110
homeward pet adoption center adoption,110
how do you get free pets in adopt me,110
how to get a free pet in adopt me,110
how to get a neon pet in adopt me,110
how to get free legendary pets in adopt me,110
how to get free pets on adopt me,110
how to get legendary pets in adopt me,110
how to put a pet up for adoption,110
hsnt kaufman county pet adoption center,110
is adopt a pet legitimate,110
is peter pan rumplestiltskin's father,110
jesus heals peter mother in law,110
katy pet adoption,110
kaufman county pet adoption center,110
kaufman pet adoption center,110
kc pet project adoption,110
kc pet project adoption fees,110
kc pet project petco adoption center,110
kelley's heart to heart pet adoption center,110
kim petras mother,110
kim petras name at birth,110
king county pet adoption,110
kittens for adoption petco,110
lancaster pet adoption,110
lily peters mother,110
longview pet adoption,110
loss of appetite after birth,110
louisville pet adoption,110
love at first sight pet adoption,110
marshall pet adoption center,110
mary s. roberts pet adoption center reviews,110
mega pets adopt me,110
meme pets adopt me,110
mikhaila peterson father,110
mother of perpetual help maryville il,110
mother of perpetual help novena prayer booklet,110
mother of the groom dresses for fall petite,110
my dad paul petersen,110
my mother chipettes,110
national pet adoption day,110
neon pet rock adopt me,110
neon snowball pet adopt me,110
new adopt me pets 2022,110
new pets in adopt me 2022,110
north country pet adoption services,110
novena for our mother of perpetual help,110
novena to our mother of perpetual help youtube,110
novena to the mother of perpetual help,110
oakland county pet adoption,110
ocala pet adoption,110
okc pet adoption,110
orange county adopt a pet,110
oregon pet adoption,110
peewee's pet adoption photos,110
pet adoption agcy crossword,110
pet adoption agency crossword,110
pet adoption akron ohio,110
pet adoption and protection center,110
pet adoption application,110
pet adoption at petco,110
pet adoption austin tx,110
pet adoption az,110
pet adoption center thrift store,110
pet adoption certificate printable,110
pet adoption contract,110
pet adoption corpus christi,110
pet adoption dayton ohio,110
pet adoption duluth mn,110
pet adoption events today,110
pet adoption fair,110
pet adoption for free,110
pet adoption free,110
pet adoption in kansas city,110
pet adoption in michigan,110
pet adoption in sc,110
pet adoption kansas city mo,110
pet adoption league tulsa,110
pet adoption long beach,110
pet adoption melbourne fl,110
pet adoption midland tx,110
pet adoption month,110
pet adoption naples fl,110
pet adoption near me dogs,110
pet adoption oklahoma city,110
pet adoption pensacola,110
pet adoption portland oregon,110
pet adoption raleigh,110
pet adoption rhode island,110
pet adoption rochester mn,110
pet adoption savannah,110
pet adoption shelters,110
pet adoption shelters near me,110
pet adoption shreveport,110
pet adoption springfield il,110
pet adoption springfield ma,110
pet adoption syracuse ny,110
pet adoption tyler tx,110
pet adoption washington state,110
pet food express adoption,110
pet smart adopt,110
pet smart adoption event,110
pet smart animal adoption,110
pet supermarket adoption,110
petal active parent,110
petco bunnies for adoption,110
petco cat adoption fee,110
pete davidson father 911,110
pete.davidson dad,110
peter doocys father,110
peter doocy's father,110
peter ducey's father,110
peter's dad family guy,110
peter's mother in law healed,110
pete's pizzeria and abortion clinic,110
petite gowns for mother of the bride,110
petite mother of bride dresses short,110
petite mother of the bride dresses long,110
petite mother of the groom dresses for fall,110
petition for adoption form,110
pets for adoption for free,110
pets for adoption in my area,110
pets up for adoption,110
petsinc adoption,110
petsmart adoption fee for cats,110
petsmart everyday adoption center,110
petsmart near me cat adoption,110
power of the dog did peter kill his father,110
preppy pets in adopt me,110
printable pet adoption certificate,110
puppy whippets for adoption,110
raleigh pet adoption,110
rarest pet in adopt me 2022,110
reno pet adoption,110
rock pet adopt me,110
rockwall pet adoption,110
rutherford county pet adoption and welfare service photos,110
san bernardino pet adoption,110
santa barbara pet adoption,110
santa cruz pet adoption,110
small pet adoption near me,110
south hills pet rescue adoption,110
st peters birthing center,110
stages of neon pets in adopt me,110
star pet adoption,110
the chipettes my mother,110
the rarest pets in adopt me,110
thundering paws pet adoption center inc,110
top pet adoption sites,110
turn a paw adoption and pet services,110
ventura county pet adoption,110
wag pet adoption,110
wake county pet adoption,110
washington dc pet adoption,110
what did pete davidson dad do,110
what is a snowball pet worth in adopt me,110
what is the most rarest pet in adopt me,110
where to adopt pets,110
whippets for adoption near me,110
why should you adopt a pet,110
